{"reading_id":"urn:uuid:b385225f-578c-4d75-ab38-d228849feab9","reading_product":"revisions/795f6ee1cc583807f817488b65fcad96ea6b2ed10203e7afad66d7badeff83e5/reading-product.json","reading_product_sha256":"795f6ee1cc583807f817488b65fcad96ea6b2ed10203e7afad66d7badeff83e5","revision_id":"795f6ee1cc583807f817488b65fcad96ea6b2ed10203e7afad66d7badeff83e5","schema_version":"reading-product-publication-pointer/1.0","validation_report":"revisions/795f6ee1cc583807f817488b65fcad96ea6b2ed10203e7afad66d7badeff83e5/validation-report.json","validation_report_sha256":"a3c90507d67a28de3ccc3409a25c09b90f822aacf96729dd2da752e820374774"}
